channel_id,niche_id,channel_name,channel_url,subscriber_count,total_videos,avg_views,format_type,language,country,description,last_scraped,status
CH2501,N026,Jungle Scout,https://www.youtube.com/channel/UC0iJ3ldvDUGiUPfGiiifzVQ,300000,500,10000,Monologue/Tutorial,en,US,Amazon FBA product research and selling tools,2026-04-16,active
CH2502,N026,My Amazon Guy - Steven Pope,https://www.youtube.com/channel/UClUSEsDS2sdgNJfCcCM_5Uw,200000,1000,5000,Monologue,en,US,Comprehensive Amazon seller education,2026-04-16,active
CH2503,N026,Helium 10,https://www.youtube.com/@Helium10,200000,500,8000,Monologue/Tutorial,en,US,Amazon seller tools and tutorials,2026-04-16,active
CH2504,N026,Wholesale Ted - Sarah Chrisp,https://www.youtube.com/@WholesaleTed,1000000,200,100000,Monologue,en,NZ,Amazon wholesale and ecommerce strategies,2026-04-16,active
CH2505,N026,Dan Vas,https://www.youtube.com/channel/UCba-OKnXOFOe3eTXlXYuDTQ,600000,300,30000,Monologue,en,US,Amazon FBA and ecommerce entrepreneur,2026-04-16,active
CH2506,N026,Tom Wang,https://www.youtube.com/channel/UCLa0uv4VkNm9d8i9AGLKC1g,300000,200,30000,Monologue,en,CA,Amazon FBA private label strategies,2026-04-16,active
CH2507,N026,Marketplace SuperHeroes,https://www.youtube.com/channel/UC0vPu0MpUQucAnZukUbtJuw,50000,300,5000,Monologue,en,IE,Amazon FBA brand building and private label,2026-04-16,active
CH2508,N026,Kev Blackburn,https://www.youtube.com/@KevBlackburn,100000,300,8000,Monologue,en,UK,Amazon online arbitrage business model,2026-04-16,active
CH2509,N026,Pat Harris,https://www.youtube.com/channel/UCb9iHmj69Xc3AP3ECEkEWjw,30000,200,3000,Monologue,en,US,Amazon FBA selling tips and strategies,2026-04-16,active
CH2510,N026,Trevin Peterson,https://www.youtube.com/channel/UCdpCZUXLtEpWYWf5eiI0qAg,100000,200,10000,Monologue,en,US,Amazon FBA journey and case studies,2026-04-16,active
CH2511,N026,Reezy Resells,https://www.youtube.com/channel/UCeq8GxD-kFVV5S1i0MCmzTg,200000,500,10000,Monologue,en,US,Amazon reselling and flipping strategies,2026-04-16,active
CH2512,N026,Nikki Kirk,https://www.youtube.com/channel/UCuoLhz78ZvavbroOhLaXK_w,30000,100,3000,Monologue,en,US,Amazon FBA for women entrepreneurs,2026-04-16,active
CH2513,N026,Sheryl Marcinek,https://www.youtube.com/channel/UCQL_hRuVWUCriM1wPm9xnjg,20000,100,2000,Monologue,en,US,Amazon selling tips and tutorials,2026-04-16,active
CH2514,N026,Full-Time FBA,https://www.youtube.com/channel/UCjfIlZRd2nFImCDGl30xCHw,50000,300,5000,Monologue,en,US,Full time Amazon FBA reselling,2026-04-16,active
CH2515,N026,Tamara Tee,https://www.youtube.com/channel/UCMybK4XtrvxB8AVEDXy-X4A,30000,200,3000,Monologue,en,CA,Amazon FBA for beginners education,2026-04-16,active
CH2516,N026,Mina Elias,https://www.youtube.com/channel/UCrbS0KD_OE2516ZLut1VYGw,50000,200,5000,Monologue,en,US,Amazon PPC and supplement brand building,2026-04-16,active
CH2517,N026,Flips4Miles,https://www.youtube.com/channel/UCd0gngaeuOlUQr8K5SEVgcA,50000,200,5000,Monologue,en,US,Amazon flipping and reselling,2026-04-16,active
CH2518,N026,Amazon Ads,https://www.youtube.com/channel/UCGRjlfFeU-5eC-ElShfwYPw,50000,300,3000,Monologue/Tutorial,en,US,Official Amazon advertising education,2026-04-16,active
CH2519,N026,Sell on Amazon (Official),https://www.youtube.com/channel/UC4B8ywA2Cz_K95w2oeWxizg,100000,300,5000,Monologue/Tutorial,en,US,Official Amazon seller education,2026-04-16,active
CH2520,N026,Fields of Profit,https://www.youtube.com/channel/UCFPLwQH8B5avF9pJ1v76dZg,30000,100,3000,Monologue,en,US,Amazon FBA farming and product sourcing,2026-04-16,active
CH2521,N026,FastTrackFBA,https://www.youtube.com/channel/UC-cS7IZUbOvet9UYjCwxTPw,30000,200,3000,Monologue,en,US,Fast tracking Amazon FBA success,2026-04-16,active
CH2522,N026,AMZScout,https://www.youtube.com/channel/UC-rV0wnbUUx8grz1Awtlt-A,30000,200,3000,Monologue/Tutorial,en,US,Amazon product research tools education,2026-04-16,active
CH2523,N026,Seller Circle,https://www.youtube.com/channel/UC1askZ5rUnmcMYmQQ4KGJZg,15000,100,2000,Monologue,en,US,Amazon seller community and tips,2026-04-16,active
CH2524,N026,Honest FBA,https://www.youtube.com/channel/UCqZYz9l1MFbeqK8CsEvo1FA,30000,100,3000,Monologue,en,UK,Honest Amazon FBA reviews and strategies,2026-04-16,active
CH2525,N026,Crescent Kao,https://www.youtube.com/channel/UCyZ1Mpi0Rsus6i3xk-tjfnQ,20000,100,2000,Monologue,en,US,Amazon FBA product launch strategies,2026-04-16,active
CH2526,N026,Orange Klik,https://www.youtube.com/channel/UC88yq_cznQoE_vsIo7NJVGQ,15000,100,2000,Monologue,en,US,Amazon seller events and education,2026-04-16,active
CH2527,N026,Camron James,https://www.youtube.com/channel/UCRC5TrqyTtLIdTdwNBKGQHA,30000,100,3000,Monologue,en,US,Amazon FBA journey and scaling,2026-04-16,active
CH2528,N026,Ad Badger,https://www.youtube.com/channel/UCSsWYJQZT32uUsjBKg9r1qA,20000,200,2000,Monologue/Tutorial,en,US,Amazon PPC advertising optimization,2026-04-16,active
CH2529,N026,Christopher Grant,https://www.youtube.com/channel/UCEPxw5n10XFuIdHdn3OCvvg,20000,100,2000,Monologue,en,US,Amazon wholesale sourcing strategies,2026-04-16,active
CH2530,N026,Brandon M. Young,https://www.youtube.com/channel/UC-JgFJyGEAGTQCDH4yWvZjg,15000,100,2000,Monologue,en,US,Amazon seller optimization and PPC,2026-04-16,active
CH2531,N026,Darren - FBA Elite,https://www.youtube.com/channel/UCS7ME2x9h334nD0OdQXpNrg,15000,100,2000,Monologue,en,UK,Amazon FBA elite strategies,2026-04-16,active
CH2532,N026,Sumner & Ali Hobart,https://www.youtube.com/channel/UCseHZ3fvnOqxfSqdMBS0U-Q,30000,100,3000,Monologue,en,US,Amazon FBA couple sharing selling tips,2026-04-16,active
CH2533,N026,Brad Sherman - Amazon,https://www.youtube.com/channel/UCIXzyxJ5coTy_LPf82eba6w,10000,80,2000,Monologue,en,US,Amazon selling strategies and tips,2026-04-16,active
CH2534,N026,BetterAMS,https://www.youtube.com/channel/UCIyDW8XfX2gTWFHK_otUwAw,10000,100,2000,Monologue,en,US,Amazon advertising management services,2026-04-16,active
CH2535,N026,Riley Bennett Amazon,https://www.youtube.com/channel/UCmNRbQ-zj8UFlBJImnDKhSQ,10000,80,2000,Monologue,en,US,Amazon FBA tips for beginners,2026-04-16,active
CH2536,N026,Adam Heist,https://www.youtube.com/channel/UC-sbTMR8bzv0YIdKNhlyLDw,100000,100,10000,Monologue,en,US,Amazon FBA retail arbitrage strategies,2026-04-16,active
CH2537,N026,Luca Davenport,https://www.youtube.com/channel/UCNQ6dw0FVlo_LazcTXraE9g,20000,80,3000,Monologue,en,UK,Amazon FBA UK seller strategies,2026-04-16,active
CH2538,N026,Seller Sessions,https://www.youtube.com/channel/UCvYbWjz7350Xc6poxlk-S0A,20000,300,2000,Monologue/Podcast,en,UK,Advanced Amazon seller podcast,2026-04-16,active
CH2539,N026,ZonGuru,https://www.youtube.com/channel/UCMFKz4QVV5JrXZ2YoyLVfLw,15000,200,2000,Monologue/Tutorial,en,US,Amazon FBA research and analytics tools,2026-04-16,active
CH2540,N026,Smartest Amazon Seller,https://www.youtube.com/channel/UCzcv9LUQ65VL5CvSnIAWKZQ,10000,200,1500,Monologue/Podcast,en,US,Smart strategies for Amazon selling,2026-04-16,active
CH2541,N026,Trivium Group,https://www.youtube.com/channel/UCW7qjIMBvEnTyXmPU7-stdw,10000,100,2000,Monologue,en,US,Amazon PPC agency education,2026-04-16,active
CH2542,N026,Farah Finds,https://www.youtube.com/channel/UCGxobO9aLRKImTylvftk1OQ,15000,80,2000,Monologue,en,US,Amazon FBA product research finds,2026-04-16,active
CH2543,N026,FBA Mastery,https://www.youtube.com/channel/UCdW4wxWc6eY1Q1PwBWtIxWQ,10000,100,2000,Monologue,en,US,Mastering Amazon FBA business,2026-04-16,active
CH2544,N026,Online Seller UK,https://www.youtube.com/channel/UCUxW6kzbsQKg5FEyeSar9_A,20000,200,2000,Monologue,en,UK,UK Amazon and ecommerce selling,2026-04-16,active
CH2545,N026,Envision Horizons,https://www.youtube.com/channel/UCTwKeNcqroTyX3k2xYvQPMg,10000,100,1500,Monologue,en,US,Amazon brand management agency,2026-04-16,active
CH2546,N026,Jonny Bradley,https://www.youtube.com/channel/UC7MLo4huZZL5_OJE3bpe3OQ,10000,80,2000,Monologue,en,UK,Amazon FBA UK journey and tips,2026-04-16,active
CH2547,N026,Chris Mangunza,https://www.youtube.com/channel/UCKUb8nCezxfSOkzwbtblE6Q,10000,80,2000,Monologue,en,US,Amazon arbitrage and FBA strategies,2026-04-16,active
CH2548,N026,That Amazon Ads Podcast,https://www.youtube.com/channel/UC36IfCZpghToycvQB3EGE4w,8000,100,1500,Podcast/Monologue,en,US,Amazon advertising deep dives,2026-04-16,active
CH2549,N026,Joe Parpheniuk,https://www.youtube.com/channel/UCMHMfdX0m3LI4ntB0YjIZMA,5000,50,1500,Monologue,en,CA,Canadian Amazon FBA seller tips,2026-04-16,active
CH2550,N026,Christopher Ducharme (Coach Chrispect),https://www.youtube.com/channel/UCRhNrQMjQBqLzkGBeES4Lpw,10000,100,1500,Monologue,en,US,Amazon coaching and seller strategies,2026-04-16,active
CH2551,N026,Amazon Wholesale - OneUpFBA,https://www.youtube.com/channel/UCa79PGdz50aXVk2ZaTOEMfQ,10000,80,2000,Monologue,en,US,Amazon wholesale sourcing education,2026-04-16,active
CH2552,N026,sellerboard,https://www.youtube.com/channel/UCymrXub6gU30lls1ntKL_Kg,10000,100,1500,Monologue/Tutorial,en,DE,Amazon profit analytics tool education,2026-04-16,active
CH2553,N026,Sell Beyond,https://www.youtube.com/channel/UCbelUg-n410lvMn2Uec9ilw,5000,50,1500,Monologue,en,US,Amazon brand growth strategies,2026-04-16,active
CH2554,N026,Cajunventures,https://www.youtube.com/channel/UCnzyQQpq3LBMPNBdvPY5qJw,10000,80,2000,Monologue,en,US,Amazon FBA arbitrage adventures,2026-04-16,active
CH2555,N026,Mr Hayden,https://www.youtube.com/channel/UCIqa7s10ddmoVi_o6g_reGg,8000,80,1500,Monologue,en,AU,Australian Amazon seller content,2026-04-16,active
CH2556,N026,Ali Lokhandwala,https://www.youtube.com/channel/UCn-y3SdZw-I9aYSdsWZX1uA,8000,50,1500,Monologue,en,US,Amazon FBA tips and strategies,2026-04-16,active
CH2557,N026,Jyles FBA,https://www.youtube.com/channel/UCW4zYP-bK8BUyM43ee6RufQ,5000,50,1500,Monologue,en,US,Amazon FBA journey content,2026-04-16,active
CH2558,N026,Jamil Rashid,https://www.youtube.com/channel/UCb3OumwnBMtCrF3ETDywGrA,8000,50,1500,Monologue,en,US,Amazon FBA and ecommerce tips,2026-04-16,active
CH2559,N026,The Shark - Amazon,https://www.youtube.com/channel/UCZSAALY_p1hAdCjsugvgk0w,5000,50,1500,Monologue,en,US,Amazon seller strategies and tips,2026-04-16,active
CH2560,N026,Hustle Buddies Official,https://www.youtube.com/channel/UC1p8cVNIJcZA9kPs3nGVSbw,10000,80,1500,Monologue,en,US,Amazon FBA hustle and motivation,2026-04-16,active
CH2561,N026,Janson Smith,https://www.youtube.com/channel/UC_LQPvDWzIC-Fr1VusOOteA,8000,50,1500,Monologue,en,US,Amazon seller journey and tips,2026-04-16,active
CH2562,N026,Amazon Ads Raw Daily,https://www.youtube.com/channel/UCyVo9OTuKs6j9eHQgnfeKBg,5000,100,1000,Monologue,en,US,Daily Amazon advertising tips,2026-04-16,active
CH2563,N026,SellerMetrics,https://www.youtube.com/channel/UCbwl0IBvA2BpoRy8go61deA,3000,50,1000,Monologue/Tutorial,en,US,Amazon PPC metrics and optimization,2026-04-16,active
CH2564,N026,AMZ One Step,https://www.youtube.com/channel/UCSJDkIfw8SJ8P5bJxQiwqUg,5000,50,1000,Monologue,en,US,Amazon product listing optimization,2026-04-16,active
CH2565,N026,Entrepreneur Adventure,https://www.youtube.com/channel/UCeNVgygMlCnOYRf_799fLqg,15000,80,2000,Monologue,en,US,Amazon FBA and entrepreneurship journey,2026-04-16,active
CH2566,N026,Nomadz Amazon,https://www.youtube.com/channel/UCV1Od62QQLo9nmNMysS6wiA,5000,50,1500,Monologue,en,US,Amazon selling and digital nomad life,2026-04-16,active
CH2567,N026,AMZ Prep,https://www.youtube.com/channel/UCTH_0CuRM0QPEWoRHRYu3nQ,3000,50,1000,Monologue,en,US,Amazon FBA prep service education,2026-04-16,active
CH2568,N026,Amazon Seller University UK,https://www.youtube.com/channel/UC8XjJ6Ubd27JM0R9S9a5BAQ,10000,100,1500,Monologue/Tutorial,en,UK,Amazon UK seller education,2026-04-16,active
CH2569,N026,AiHello Amazon Ads,https://www.youtube.com/channel/UCVASNUlKjKHGhOhu8SXxB5Q,5000,80,1000,Monologue/Tutorial,en,US,Amazon PPC automation tool,2026-04-16,active
CH2570,N026,ddzim PPC,https://www.youtube.com/channel/UCkTshmKGa8wYxf37b5lDATw,3000,50,1000,Monologue,en,US,Amazon PPC management education,2026-04-16,active
CH2571,N026,BidX Amazon Advertising,https://www.youtube.com/channel/UCum0tY6zMH468FeMTffRMpw,3000,50,1000,Monologue/Tutorial,en,DE,Amazon advertising optimization tool,2026-04-16,active
CH2572,N026,Sellerise,https://www.youtube.com/channel/UCP-_Pmpq6ifdQ7bAZJ-LZNQ,3000,50,1000,Monologue/Tutorial,en,US,Amazon seller profit analytics,2026-04-16,active
CH2573,N026,Kevin David (Amazon FBA),https://www.youtube.com/@KevinDavid,1200000,500,50000,Monologue,en,US,Amazon FBA and online business,2026-04-16,active
CH2574,N026,Travis Marziani (Amazon),https://www.youtube.com/@TravisMarziani,100000,300,8000,Monologue,en,US,Amazon FBA and ecommerce strategies,2026-04-16,active
CH2575,N026,Beau Crabill,https://www.youtube.com/@BeauCrabill,200000,300,10000,Monologue,en,US,Amazon reselling and arbitrage,2026-04-16,active
CH2576,N026,Ryan Grant - The Selling Family,https://www.youtube.com/@TheSellingFamily,50000,200,3000,Monologue,en,US,Amazon FBA for families,2026-04-16,active
CH2577,N026,Raiken Profit,https://www.youtube.com/@RaikenProfit,100000,300,5000,Monologue,en,US,Amazon FBA retail and online arbitrage,2026-04-16,active
CH2578,N026,Cracker Jack Amazon,https://www.youtube.com/@CrackerJackAmazon,20000,100,2000,Monologue,en,US,Amazon wholesale and arbitrage,2026-04-16,active
CH2579,N026,Stephen Smotherman - FBA,https://www.youtube.com/@StephenSmotherman,30000,200,3000,Monologue,en,US,Full time FBA arbitrage and wholesale,2026-04-16,active
CH2580,N026,AMZ Product Launcher,https://www.youtube.com/channel/UCuQy1gL1mlCGESvbi1vQW0g,5000,50,1000,Monologue,en,US,Amazon product launch strategies,2026-04-16,active
CH2581,N026,Seller Arena,https://www.youtube.com/channel/UC3qaB4Ra_fd5t8YolgkW3WA,3000,50,1000,Monologue,en,US,Amazon seller community content,2026-04-16,active
CH2582,N026,Amazon Global Selling SEA,https://www.youtube.com/channel/UCesBoHGCk4EEpGy4t6Yf_2A,5000,80,1000,Monologue/Tutorial,en,SG,Amazon selling in Southeast Asia,2026-04-16,active
CH2583,N026,How To Sell on Amazon from Canada,https://www.youtube.com/channel/UC0Of3qgrogGrjSY_gfM7jaw,5000,50,1500,Monologue,en,CA,Canadian Amazon selling strategies,2026-04-16,active
CH2584,N026,Rosenbaum & Segall - Amazon Legal,https://www.youtube.com/channel/UCQITcjv6JO0MAeD_QyIfWZw,5000,100,1000,Monologue,en,US,Amazon seller legal advice,2026-04-16,active
CH2585,N026,Amazing at Home,https://www.youtube.com/@AmazingAtHome,100000,200,8000,Monologue,en,US,Amazon FBA from home strategies,2026-04-16,active
CH2586,N026,Clear the Shelf,https://www.youtube.com/@ClearTheShelf,50000,100,5000,Monologue,en,US,Amazon clearance and arbitrage,2026-04-16,active
CH2587,N026,Retail Robin,https://www.youtube.com/@RetailRobin,30000,100,3000,Monologue,en,US,Retail arbitrage for Amazon FBA,2026-04-16,active
CH2588,N026,Reselling King,https://www.youtube.com/@ResellingKing,20000,80,2000,Monologue,en,US,Amazon and eBay reselling strategies,2026-04-16,active
CH2589,N026,Nate Jackson FBA,https://www.youtube.com/@NateJacksonFBA,30000,100,3000,Monologue,en,US,Amazon FBA wholesale strategies,2026-04-16,active
CH2590,N026,Larry Lubarsky,https://www.youtube.com/@LarryLubarsky,50000,200,5000,Monologue,en,US,Amazon arbitrage and FBA selling,2026-04-16,active
CH2591,N026,Andy Isom,https://www.youtube.com/@AndyIsom,100000,200,8000,Monologue,en,US,Amazon FBA and ecommerce journey,2026-04-16,active
CH2592,N026,The Bootstrap Boutique,https://www.youtube.com/@BootstrapBoutique,20000,200,2000,Monologue,en,US,Amazon private label for beginners,2026-04-16,active
CH2593,N026,Brand Creator Amazon,https://www.youtube.com/@BrandCreatorAMZ,15000,80,2000,Monologue,en,US,Building brands on Amazon marketplace,2026-04-16,active
CH2594,N026,AMZ Pathfinder,https://www.youtube.com/@AMZPathfinder,10000,80,1500,Monologue,en,US,Finding profitable Amazon products,2026-04-16,active
CH2595,N026,Seller Interactive,https://www.youtube.com/@SellerInteractive,10000,100,1500,Monologue,en,US,Amazon seller account management,2026-04-16,active
CH2596,N026,Private Label Masters,https://www.youtube.com/@PrivateLabelMasters,15000,80,2000,Monologue,en,US,Amazon private label course content,2026-04-16,active
CH2597,N026,Titan Network - Amazon,https://www.youtube.com/@TitanNetwork,10000,50,2000,Monologue,en,US,Amazon seller community and masterminds,2026-04-16,active
CH2598,N026,Amazing Seller - Scott V.,https://www.youtube.com/@AmazingSeller,100000,500,5000,Monologue/Podcast,en,US,Amazon private label journey podcast,2026-04-16,active
CH2599,N026,Just One Dime,https://www.youtube.com/@JustOneDime,200000,200,15000,Monologue,en,US,Amazon FBA arbitrage to private label,2026-04-16,active
CH2600,N026,Seller Tradecraft,https://www.youtube.com/@SellerTradecraft,20000,80,2000,Monologue,en,US,Amazon seller optimization strategies,2026-04-16,active
