channel_id,niche_id,channel_name,channel_url,subscriber_count,total_videos,avg_views,format_type,language,country,description,last_scraped,status
CH5901,N060,The DUI Guy,https://www.youtube.com/c/theDUIGuy,17000000,500,2000000,Monologue,en,US,Criminal defense and police interaction education,,active
CH5902,N060,CLR Bruce Rivers,https://www.youtube.com/@CLRBruceRivers,2000000,1000,100000,Monologue,en,US,Criminal lawyer reacts to viral cases,,active
CH5903,N060,The Civil Rights Lawyer,https://www.youtube.com/@thecivilrightslawyer,1500000,400,200000,Monologue,en,US,Civil rights and criminal law education,,active
CH5904,N060,Law and Crime Network,https://www.youtube.com/@LawAndCrimeNetwork,5100000,5000,100000,Monologue/Interview,en,US,Live trial coverage and criminal law analysis,,active
CH5905,N060,Crime Talk,https://www.youtube.com/@CrimeTalk,500000,2000,20000,Monologue,en,US,Scott Reisch criminal defense attorney commentary,,active
CH5906,N060,Robert Gouveia Esq,https://www.youtube.com/@RobertGouveia,200000,1000,20000,Monologue,en,US,Watching the Watchers criminal defense attorney,,active
CH5907,N060,natalielawyerchick,https://www.youtube.com/c/natalielawyerchick,200000,300,30000,Monologue,en,US,Criminal law commentary and legal lifestyle,,active
CH5908,N060,Hampton Criminal Defense,https://www.youtube.com/@HamptonCriminalDefense,50000,200,5000,Monologue,en,US,Criminal defense education,,active
CH5909,N060,Criminal Defense Lawyer Veronica Barton,https://www.youtube.com/@VeronicaBarton,30000,100,5000,Monologue,en,US,Criminal defense attorney education,,active
CH5910,N060,Ryan Pacyga Attorney,https://www.youtube.com/@RyanPacyga,30000,200,5000,Monologue,en,US,Criminal defense attorney Minnesota,,active
CH5911,N060,Big Man Law DUI,https://www.youtube.com/@BigManLaw,30000,100,5000,Monologue,en,US,DUI criminal defense attorney,,active
CH5912,N060,Criminal Defense Attorney Jamahl Kersey,https://www.youtube.com/@JamahlKersey,30000,100,5000,Monologue,en,US,Criminal defense education San Diego,,active
CH5913,N060,DOD LAW Criminal Defense,https://www.youtube.com/@DODLAW,20000,100,5000,Monologue,en,US,San Diego criminal defense attorney,,active
CH5914,N060,Jack Rice Criminal Defense,https://www.youtube.com/@JackRice,20000,100,5000,Monologue,en,US,Criminal defense commentary,,active
CH5915,N060,Carl Barkemeyer Criminal Defense,https://www.youtube.com/@CarlBarkemeyer,20000,100,5000,Monologue,en,US,Louisiana criminal defense attorney,,active
CH5916,N060,Cody Warner NYC Criminal Defense,https://www.youtube.com/@CodyWarner,20000,100,5000,Monologue,en,US,NYC criminal defense attorney,,active
CH5917,N060,Joslyn Law Firm,https://www.youtube.com/@JoslynLawFirm,20000,100,5000,Monologue,en,US,Ohio criminal defense firm,,active
CH5918,N060,J. Ryan Brown Law Criminal Defense,https://www.youtube.com/@JRyanBrownLaw,20000,100,5000,Monologue,en,US,Criminal defense education,,active
CH5919,N060,Right Law Group,https://www.youtube.com/@RightLawGroup,20000,100,5000,Monologue,en,US,Colorado criminal defense,,active
CH5920,N060,BRCK Criminal Defense,https://www.youtube.com/@BRCKDefense,20000,100,5000,Monologue,en,US,Criminal defense attorneys,,active
CH5921,N060,Whiddon Criminal Defense,https://www.youtube.com/@WhiddonDefense,20000,50,5000,Monologue,en,US,Criminal defense education,,active
CH5922,N060,IE Criminal Defense,https://www.youtube.com/@IECrimDefense,20000,50,5000,Monologue,en,US,Inland Empire criminal defense,,active
CH5923,N060,Olliers Solicitors,https://www.youtube.com/@OlliersSolicitors,20000,50,5000,Monologue,en,GB,UK criminal defense solicitors,,active
CH5924,N060,Las Vegas Criminal Lawyer Thomas Moskal,https://www.youtube.com/@ThomasMoskal,20000,50,5000,Monologue,en,US,Las Vegas criminal defense,,active
CH5925,N060,Brannan Law Firm,https://www.youtube.com/@BrannanLawFirm,20000,50,5000,Monologue,en,US,Texas criminal defense lawyer,,active
CH5926,N060,Josh Camson Criminal Defense,https://www.youtube.com/@JoshCamson,20000,50,5000,Monologue,en,US,Criminal defense and appellate law,,active
CH5927,N060,SC Criminal Defense Susan Williams,https://www.youtube.com/@SCCrimDefense,20000,50,5000,Monologue,en,US,South Carolina criminal defense,,active
CH5928,N060,Shaffie Law,https://www.youtube.com/@ShaffieLaw,20000,50,5000,Monologue,en,US,Criminal defense law firm,,active
CH5929,N060,Dayne Phillips Attorney,https://www.youtube.com/@DaynePhillips,20000,50,5000,Monologue,en,US,Criminal defense attorney,,active
CH5930,N060,Law Office of Louis Goodman,https://www.youtube.com/@LouisGoodman,20000,50,5000,Monologue,en,US,Criminal defense Alameda County,,active
CH5931,N060,Erskine Law Austin Criminal Lawyer,https://www.youtube.com/@ErskineLaw,20000,50,5000,Monologue,en,US,Austin TX criminal defense,,active
CH5932,N060,Oliverson Law DUI,https://www.youtube.com/@OliversonLaw,20000,50,5000,Monologue,en,US,DUI defense attorney education,,active
CH5933,N060,Pariente Law Firm,https://www.youtube.com/@ParienteLaw,20000,50,5000,Monologue,en,US,Criminal defense Florida,,active
CH5934,N060,Criminal Defense West Michigan,https://www.youtube.com/@CDWestMichigan,20000,50,5000,Monologue,en,US,Michigan criminal defense,,active
CH5935,N060,Dahlem Criminal Defence,https://www.youtube.com/@DahlemDefence,20000,50,5000,Monologue,en,CA,Canadian criminal defence,,active
CH5936,N060,Vindicate Criminal Law Group,https://www.youtube.com/@VindicateLaw,20000,50,5000,Monologue,en,CA,Canadian criminal law,,active
CH5937,N060,Karen McArthur Criminal Defence,https://www.youtube.com/@KarenMcArthur,20000,50,5000,Monologue,en,CA,Canadian criminal defence lawyer,,active
CH5938,N060,Aitken Robertson Criminal DUI Lawyers,https://www.youtube.com/@AitkenRobertson,20000,50,5000,Monologue,en,CA,Canadian DUI defense,,active
CH5939,N060,VS Criminal Defense Attorneys,https://www.youtube.com/@VSCrimDefense,20000,50,5000,Monologue,en,US,Criminal defense team content,,active
CH5940,N060,Stephen T Bowling DWI Defense,https://www.youtube.com/@StephenBowling,20000,50,5000,Monologue,en,US,DWI defense Austin TX,,active
CH5941,N060,JCS Criminal Psychology,https://www.youtube.com/@JCSCriminalPsychology,7000000,30,10000000,Monologue,en,US,Criminal interrogation psychology analysis,,active
CH5942,N060,Matt Orchard Criminal Psychology,https://www.youtube.com/@MattOrchard,2000000,50,2000000,Monologue,en,NZ,Crime and psychology analysis,,active
CH5943,N060,True Crime Daily,https://www.youtube.com/@TrueCrimeDaily,2000000,2000,50000,Monologue,en,US,Daily true crime legal coverage,,active
CH5944,N060,Coffeehouse Crime,https://www.youtube.com/@CoffeehouseCrime,2000000,200,500000,Monologue,en,GB,True crime with legal analysis,,active
CH5945,N060,Lawyers Criminal Razumich,https://www.youtube.com/@RazumichLaw,20000,50,5000,Monologue,en,US,Criminal defense associates,,active
CH5946,N060,LegalMatch Criminal Defense,https://www.youtube.com/@LegalMatchCrim,20000,50,5000,Monologue,en,US,Criminal defense matching,,active
CH5947,N060,Criminal Defense Clinics,https://www.youtube.com/@CrimDefenseClinics,20000,50,5000,Monologue,en,US,Law school criminal defense clinics,,active
CH5948,N060,Criminal Law Updates,https://www.youtube.com/@CrimLawUpdates,20000,50,5000,Monologue,en,US,Criminal law news and changes,,active
CH5949,N060,Federal Criminal Defense,https://www.youtube.com/@FedCrimDefense,20000,50,5000,Monologue,en,US,Federal criminal case defense,,active
CH5950,N060,White Collar Crime Defense,https://www.youtube.com/@WhiteCollarCrime,20000,50,5000,Monologue,en,US,White collar criminal defense,,active
CH5951,N060,Drug Crime Defense,https://www.youtube.com/@DrugCrimeDefense,20000,50,5000,Monologue,en,US,Drug offense defense education,,active
CH5952,N060,Domestic Violence Defense,https://www.youtube.com/@DVDefense,20000,50,5000,Monologue,en,US,DV charge defense education,,active
CH5953,N060,Sex Crime Defense,https://www.youtube.com/@SexCrimeDefense,20000,50,5000,Monologue,en,US,Sex offense defense education,,active
CH5954,N060,Juvenile Criminal Defense,https://www.youtube.com/@JuvCrimDefense,20000,30,5000,Monologue,en,US,Juvenile justice defense,,active
CH5955,N060,Traffic Law Defense,https://www.youtube.com/@TrafficLawDefense,20000,50,5000,Monologue,en,US,Traffic violation defense,,active
CH5956,N060,Expungement Guide,https://www.youtube.com/@ExpungementGuide,20000,50,5000,Monologue,en,US,Criminal record expungement,,active
CH5957,N060,Bail Bond Education,https://www.youtube.com/@BailBondEdu,20000,50,5000,Monologue,en,US,Bail system education,,active
CH5958,N060,Plea Bargain Guide,https://www.youtube.com/@PleaBargainGuide,20000,30,5000,Monologue,en,US,Understanding plea bargains,,active
CH5959,N060,Sentencing Law,https://www.youtube.com/@SentencingLaw,20000,30,5000,Monologue,en,US,Criminal sentencing education,,active
CH5960,N060,Appeals Court Criminal,https://www.youtube.com/@CrimAppeals,20000,30,5000,Monologue,en,US,Criminal appeals process,,active
CH5961,N060,Probation and Parole Guide,https://www.youtube.com/@ProbationParole,20000,30,5000,Monologue,en,US,Probation and parole education,,active
CH5962,N060,Evidence Law Criminal,https://www.youtube.com/@CrimEvidence,20000,30,5000,Monologue,en,US,Criminal evidence rules,,active
CH5963,N060,Constitutional Criminal Rights,https://www.youtube.com/@ConstitutionalRights,20000,30,5000,Monologue,en,US,Constitutional protections in criminal law,,active
CH5964,N060,Miranda Rights Guide,https://www.youtube.com/@MirandaRights,20000,30,5000,Monologue,en,US,Miranda rights and police interactions,,active
CH5965,N060,Search and Seizure Law,https://www.youtube.com/@SearchSeizure,20000,30,5000,Monologue,en,US,Fourth Amendment education,,active
CH5966,N060,Self Defense Law Guide,https://www.youtube.com/@SelfDefenseLaw,20000,50,5000,Monologue,en,US,Self defense legal standards,,active
CH5967,N060,Stand Your Ground Law,https://www.youtube.com/@StandYourGround,20000,30,5000,Monologue,en,US,Stand your ground law education,,active
CH5968,N060,Castle Doctrine Legal,https://www.youtube.com/@CastleDoctrine,20000,30,5000,Monologue,en,US,Castle doctrine legal analysis,,active
CH5969,N060,Police Accountability,https://www.youtube.com/@PoliceAccountability,50000,200,10000,Monologue,en,US,Police accountability legal analysis,,active
CH5970,N060,Body Cam Legal Analysis,https://www.youtube.com/@BodyCamAnalysis,50000,200,10000,Monologue,en,US,Body camera footage legal review,,active
CH5971,N060,First Amendment Audits,https://www.youtube.com/@FirstAmendmentAudits,100000,300,20000,Monologue,en,US,First amendment right testing,,active
CH5972,N060,Criminal Justice Reform,https://www.youtube.com/@CrimJusticeReform,20000,50,5000,Monologue,en,US,Criminal justice system reform,,active
CH5973,N060,Wrongful Conviction,https://www.youtube.com/@WrongfulConviction,30000,100,5000,Monologue,en,US,Wrongful conviction cases,,active
CH5974,N060,Innocence Project,https://www.youtube.com/@InnocenceProject,50000,100,10000,Monologue,en,US,Exonerating wrongfully convicted,,active
CH5975,N060,Prison Law,https://www.youtube.com/@PrisonLaw,20000,30,5000,Monologue,en,US,Prisoner rights and prison law,,active
CH5976,N060,Death Penalty Information,https://www.youtube.com/@DeathPenaltyInfo,20000,30,5000,Monologue,en,US,Capital punishment education,,active
CH5977,N060,Cybercrime Law,https://www.youtube.com/@CybercrimeLaw,20000,30,5000,Monologue,en,US,Cybercrime and computer fraud,,active
CH5978,N060,Gun Laws Guide,https://www.youtube.com/@GunLawsGuide,30000,100,5000,Monologue,en,US,Firearms laws by state,,active
CH5979,N060,DUI Law Education,https://www.youtube.com/@DUILawEdu,20000,50,5000,Monologue,en,US,DUI law and defense education,,active
CH5980,N060,Criminal Procedure,https://www.youtube.com/@CrimProcedure,20000,30,5000,Monologue,en,US,Criminal procedure education,,active
CH5981,N060,Grand Jury Guide,https://www.youtube.com/@GrandJuryGuide,20000,30,5000,Monologue,en,US,Grand jury process education,,active
CH5982,N060,Forensic Legal Analysis,https://www.youtube.com/@ForensicLegal,20000,30,5000,Monologue,en,US,Forensic evidence in court,,active
CH5983,N060,Expert Witness Guide,https://www.youtube.com/@ExpertWitness,20000,30,5000,Monologue,en,US,Expert testimony education,,active
CH5984,N060,Crime Scene Legal,https://www.youtube.com/@CrimeSceneLegal,20000,30,5000,Monologue,en,US,Crime scene evidence law,,active
CH5985,N060,Jury Trial Guide,https://www.youtube.com/@JuryTrialGuide,20000,30,5000,Monologue,en,US,Jury trial process education,,active
CH5986,N060,Criminal Defense Strategies,https://www.youtube.com/@CrimDefenseStrat,20000,30,5000,Monologue,en,US,Defense strategy education,,active
CH5987,N060,Homicide Law,https://www.youtube.com/@HomicideLaw,20000,30,5000,Monologue,en,US,Homicide charges and defense,,active
CH5988,N060,Theft Crime Defense,https://www.youtube.com/@TheftDefense,20000,30,5000,Monologue,en,US,Theft and property crime defense,,active
CH5989,N060,Assault Defense Law,https://www.youtube.com/@AssaultDefense,20000,30,5000,Monologue,en,US,Assault charge defense education,,active
CH5990,N060,Fraud Defense Law,https://www.youtube.com/@FraudDefense,20000,30,5000,Monologue,en,US,Fraud charge defense education,,active
CH5991,N060,Conspiracy Law,https://www.youtube.com/@ConspiracyLaw,20000,30,5000,Monologue,en,US,Conspiracy charge education,,active
CH5992,N060,RICO Law Guide,https://www.youtube.com/@RICOLaw,20000,30,5000,Monologue,en,US,RICO and organized crime law,,active
CH5993,N060,Money Laundering Defense,https://www.youtube.com/@MoneyLaunderingDef,20000,30,5000,Monologue,en,US,Financial crime defense,,active
CH5994,N060,Arson Law Defense,https://www.youtube.com/@ArsonDefense,20000,20,5000,Monologue,en,US,Arson charge defense education,,active
CH5995,N060,Stalking Law,https://www.youtube.com/@StalkingLaw,20000,20,5000,Monologue,en,US,Stalking and harassment law,,active
CH5996,N060,Embezzlement Defense,https://www.youtube.com/@EmbezzlementDef,20000,20,5000,Monologue,en,US,Embezzlement defense education,,active
CH5997,N060,Obstruction of Justice,https://www.youtube.com/@ObstructionLaw,20000,20,5000,Monologue,en,US,Obstruction charges explained,,active
CH5998,N060,Perjury Law Guide,https://www.youtube.com/@PerjuryLaw,20000,20,5000,Monologue,en,US,Perjury and false statements law,,active
CH5999,N060,Resisting Arrest Law,https://www.youtube.com/@ResistingArrest,20000,20,5000,Monologue,en,US,Resisting arrest charge defense,,active
CH6000,N060,Criminal Record Sealing,https://www.youtube.com/@CrimRecordSealing,20000,30,5000,Monologue,en,US,Sealing criminal records education,,active
